context,id
"## Context and Problem Statement\nAs any modern system, Volley Management faces a problem of concurrent changes to data and we need to support such scenario.\nWe explicitly do not consider an option to go without concurrency checks - time will tell if it is a good decision).\n## Decision Drivers <!-- optional -->\n* Performance - decision should support high throughput scenarios\n* Maintainability - amount of code needed to write should be minimized\n",2526
"## Context\nWe use RDS for tenant databases. Tenants can bind more than one application to a database instance created via the services console. Database migrations were broken when a binding was removed and re-added, or when another bound application other than the one that created the database tables attempted to modify them.\nPreviously the RDS broker PostgreSQL engine copied the MySQL engine and granted all rights on the database to the newly created user. In PostgreSQL this will give the user rights to create tables, but because it has a more finely-grained permission model than MySQL this does not give the user rights on existing tables, or tables newly created by other users.\nOnly the owner of a table can alter/drop it, and you cannot grant this permission to other users. Users who are the owners of tables cannot be removed until the table ownership is changed.\nWe attempted to work around the PostgreSQL permissions system in the following ways:\n* Using [`ALTER DEFAULT PRIVILEGES`](https://www.postgresql.org/docs/9.5/static/sql-alterdefaultprivileges.html) on every newly created user to `GRANT ALL ON PUBLIC` - this means that every user can `SELECT`, `INSERT`, and `DELETE`, but because only the table owner can `ALTER` or `DROP` this will not allow other bound users to run migrations. This is also limited to the `PUBLIC` (default) schema, so would fail to work for any applications that have custom schemas.\n* Making the group the owner of the `PUBLIC` schema. This allowed members of the group to `DROP` tables within the schema, but still did not allow them to `ALTER` these tables.\n* Creating a ""parent"" group that is given ownership of all tables, sequences, and functions. New users are granted rights on this group and thus can carry out all owner actions on group-owned items. A [DDL event trigger](https://www.postgresql.org/docs/9.5/static/event-trigger-definition.html) using the built-in `REASSIGN OWNED BY` command handed over ownership of all resources owned by the current user to the parent `$DBNAME_owner` group. This worked perfectly on all the PostgreSQL databases we tested with, however RDS does not allow use of event triggers so it was unworkable in production.\n",224
## Context and Problem Statement\nRunning Service Tests requires PostgreSQL. To ensure an instance is always up and running a container has to be manually launched or started automaticially.\n,699
## Context\nWe need a system to manage the lifecycle of a grant application.\n,5009
"## Context\nWe are using raw `[]byte` for merkle proofs in `abci.ResponseQuery`. It makes hard to handle multilayer merkle proofs and general cases. Here, new interface `ProofOperator` is defined. The users can defines their own Merkle proof format and layer them easily.\nGoals:\n- Layer Merkle proofs without decoding/reencoding\n- Provide general way to chain proofs\n- Make the proof format extensible, allowing thirdparty proof types\n",4130
"## Context\nAzure Cloud Services and Microsoft Dynamics 365 have been proposed to support the CCP case & contact management, therefore, to maximise vendor reuse\n& interoperability, Azure's identity management system will be used to provide authentication for the frontend application (back stage/SEPA users).\n## Decision Drivers\nSEPA uses Active Directory for it's existing internal account management so providing one unified single sign on login would improve security and usability.\n",5157
"## Context\nAs it's hard to understand code, it is crucial that anybody can easily\nunderstand the code you're working on. This applies to all levels of code, not\nonly the code itself, but groups of code, complete applications and groups of\napplications.\n",1416
## Context\nWe need to record the architectural decisions made on this project.\n,4002
"## Context\nThe rig defined at [Bookit Infrastructure](https://github.com/buildit/bookit-infrastructure) is an instance of the AWS Bare Metal Rig.\nWhilst it's rather generic as it is, it is specific to Bookit's needs.\nThe AWS Bare Metal Rig is also intended to offer choices for the different components (Compute - ECS EC2 vs ECS Fargate vs EKS, RDS - Aurora MySQL vs Aurora Postgres vs Aurora Serverless, etc).\nThe only way to capture that is via branches which can be hard to discover.\nFinally, there is not a single repo that represents the latest and greatest version of the AWS Bare Metal Rig.  As instances of Rigs diverge, it is difficult to instantiate a new one that includes all of the latest features\n",1742
"## Context\nWe have inherited a relatively large and complex legacy code base, mostly written in PHP.\nPHP [appears to be on a downwards trend as a language](https://pypl.github.io/PYPL.html?country=GB),\nespecially in contrast with Python. It's likely it will become increasingly difficult\nto find good PHP developers in future.\nAnecdotally, PHP is not seen as a desirable language for developers to work with. It doesn't\nhave the cool factor of newer languages like golang; nor the clean syntax and API of\nlanguages of similar pedigree, such as Python.\nOur code base is also showing its age somewhat. Some of the libraries are starting to rot.\nA mix of contractors and developers working on the code base over several years has\nresulted in a mix of styles and approaches. While we have already cleared out a lot\nof unused and/or broken code, there is likely to be more we haven't found yet.\nWe are also lagging behind the latest Design System guidelines, as our application was one\nof the first to go live, before the current iteration of the Design System existed.\nThis means that any changes to design have to be done piecemeal and manually: we can't\nsimply import the newest version of the design system and have everything magically update.\nThis combination of factors means that the code base can be difficult to work with:\nresistant to change and easy to break.\n",1652
"## Context\n- Originally we wanted to use just PointerEvents API for capturing events because the API covers mouse and pointer inputs.\n- Unfortunately Safari and iOS have very limited support. Safari does currently have an experimental API for it but the movementX and movementY properties are always 0.\n- MovementX/Y is a clean browser only method for determining distance without having to track previous coordinates.\n- Mobile is a secondary concern for this app, but pointer events on desktop Safari is also unsupported :(\n",873
"## Context\nAs we formally establish Dapr component version, we need to decide if we want to couple CLI versions with runtime versions.\n",78
## Problem\nMost of the credentials/information of the environment (like a service address) are only available as soon the application is deployed.\n,1745
"## Context and Problem Statement\nIn order to deliver BFI's IIIF Universal Viewer auditing platform, an\nidentity and access management solution must be provisioned which\nsupports user creation and registration, user management, and\nauthentication and authorisation.\n## Decision Drivers\n* Ease of initial deployment and configuration of the solution.\n* Ongoing hosting and maintenance costs of the solution.\n* Availability of core features to satisfy the project requirements with\nno / minimal costs.\n",4857
"## Context\nBookit needs a persistence mechanism.  There are many to choose from that fit an application's needs.  Currently, we believe a SQL/RDBMS approach fits better than NoSQL.  There's not a lot of context to add to that, just a quick poll of the engineers when we kicked off the project.  With that in mind, we wanted something hosted/PaaS.\nGiven we're in AWS, RDS is an obvious choice.  We don't currently have a preference for DB vendor/implementation, but are drawn to open source and free.  MySql and PostgreSql fit that criteria.\nFurther, AWS RDS has their own MySql implementation which provides much better performance and up to the minute backups with no degredation for fractions of a penny/hr more than the standard MySql over RDS.  And while Bookit's usage might not warrant the need for higher performance, there is always a need for high availability and Aurora provides that in a very hands off way.  There is also an Aurora implentation for PostgreSql but at the time of this decision, that is in Preview so we decided to skip it.\n",1740
## Context\nStoring data in hybrid storage (off-chain and on-chain) presented problems with data inconsistency when some data was written off-chain but it's on-chain reference hasn't been committed yet. This would cause some data being corrupted under certain conditions.\n,1558
"## Problem\nOnly plugins like `dump` and `quickdump` are able to represent any KeySet\n(as they are designed to do so). Limitations of other storage plugins are\ne.g., that not every structure of configuration is allowed.\nSome of these limitations were documented `infos/status`, others were not.\n",1318
"## Context\n[Command-query separation](https://martinfowler.com/bliki/CommandQuerySeparation.html) states that every method should\neither be a command that performs an action, or a query that returns data to the caller, but not both.\nAdopting command-query separation makes a clear separation of methods that change state from those that don't. So we can\nuse queries with much more confidence, and only be careful with commands orchestration.\nCommands and queries terminology is already used in the `menu-generation` application.\n",647
"## Context\nWhen debugging it is useful to be sure of what the deployed version of the application is. In addition, when debugging date and time issues (e.g openness) then it is useful to know the time in UTC from the point of view of the application.\n",2198
## Context\nThe software could be developed in one big (Gradle) project.\nThis would make integration easier.\nAt the same time this would make re-use of the code outside of this project harder.\nOne big project would probably lead to worse code since there would not be the need to have defined API boundaries.\n,2626
"## Context\nDuring a delivery for a mother in the mother program, we will need to create one or more new children. Filling in details during delivery and during PNC visits will need switching between them easy.\nAt the same time, we are also thinking of creating the concept of a family. Here, the individuals of a family will be linked to the head of the household through a relationship.\nWe need the modeling of a relationship to be a generic structure that can support both these use cases.\n",2829
## Context\nWe need a some way to authenticate and manage Link Platform Adminstrators.  Administrators will need to log in to their Link Instances to manage data and configuration.\n,5024
"## Context\nThe RE Autom8 team originally wrote and maintained this broker, in collaboration with Cyber Security. It is configured as a service broker in the Ireland and London regions of GOV.UK PaaS, and enabled for a few GDS-internal tenants. The code lives in a subdirectory of the `alphagov/tech-ops` repository, and the pipeline which builds and deploys it lives in the Tech Ops multi-tenant Concourse.\n",3291
"## Context\nThe issue motivating this decision, and any context that influences or constrains the decision.\n",4804
"## Context\nNAV currently has Kafka running on-premise, but have plans to move everything to the cloud.\nKafkarator will create an integration between applications and Kafka, removing some manual work and putting more configuration in code.\nThe plan is hosted Kafka from Aiven, eliminating the need for maintaining our own Kafka cluster on-premise.\n",2837
## Context and Problem Statement\nWe want to connect to Newslabs' shared STT service (named Newslabs PSTT).\n,5243
"## Context\nPIMS requires a database to store all property information.\nThe data is relational, requiring constraints and must run within a Linux docker container on OpenShift.\nAdditionally it must be supported by Entity Framework Core 3.1.\n",3966
"## Context and Problem Statement\n[ADR-0003](0003-threadsafe-interfaces.md) introduced support for ""thread-safe\ninterfaces"" - possibly leading to the impression that there is such a thing as\nnon-threadsafe interfaces and confusion about exactly what the attribute means.\nHowever, the entire concept of non-threadsafe interfaces is a misconception -\nthe Rust compiler insists that everything wrapped by uniffi is thread-safe -\nthe only question is who manages this thread-safety. Interfaces which are not\nmarked as thread-safe cause uniffi to wrap the interface in a mutex which is\nhidden in the generated code and therefore not obvious to the casual reader.\nThe `[Threadsafe]` marker acts as a way for the component author to opt out of\nthe overhead and blocking behaviour of this mutex, at the cost of opting in to\nmanaging their own locking internally. This ADR proposes that uniffi forces\ncomponent authors to explicitly manage that locking in all cases - or to put\nthis in Rust terms, that all structs supported by uniffi must already be\n`Send+Sync`\nNote that this ADR will hence-forth use the term `Send+Sync` instead of\n""Threadsafe"" because it more accurately describes the actual intent and avoids\nany misunderstandings that might be caused by using the somewhat broad and\ngeneric ""Threadsafe"".\n## Decision Drivers\n* Supporting non-`Send+Sync` structs means uniffi must add hidden locking to make\nthem `Send+Sync`. We consider this a ""foot-gun"" as it may lead to accidentally\nhaving method calls unexpectedly block for long periods, such as\n[this Fenix bug](https://github.com/mozilla-mobile/fenix/issues/17086)\n(with more details available in [this JIRA ticket](https://jira.mozilla.com/browse/SDK-157)).\n* Supporting such structs will hinder uniffi growing in directions that we've\nfound are desired in practice, such as allowing structs to use [alternative\nmethod receivers](https://github.com/mozilla/uniffi-rs/issues/417) or to\n[pass interface references over the FFI](https://github.com/mozilla/uniffi-rs/issues/419).\n",4952
## Context\nWe need to record the architectural decisions made on this project.\n,165
## Context and Problem Statement\nWe found that without a standardised format our javascript files ended up with different\nformats in different files or even multiple formats in the same file.  We also found that\nour IDEs had different configurations which meant that using an autoformat tool would give\ndifferent results when each of us do it.\n## Decision Drivers\n* We wanted to spend less time doing manual formatting\n* We wanted to spend less time undoing autoformatting which had been applied to unchanged lines\n* We wanted to see easily which lines had actually changed when reviewing PRs\n* We wanted to avoid discussions about individual's preferences for particular\n,3521
## Context\nSome ops have an ordinal parameter which switches between a few possible modes. Giving those modes a proper name\nmakes usage and documentation easier.\n,994
"## Context\nHaving decided on [ADR 2](adr-002.md), we foresee that the Alfa code base will be both significantly larger and more complex than the code base of our proprietary engine. This is due to the fact that we will have to implement a great deal of APIs that we have previously relied on the browser implementations of. Coupled with the fact that the most common type of bug we have encountered in the past has been stray `undefined` or `null` values and APIs receiving incorrect parameters, plain JavaScript, even if covered by tests, is simply not an option moving forward. We will either need tooling that can sanity check our JavaScript or move to a language with a proper type system that can enforce API contracts.\nHowever, given that browsers are still part of the equation, Alfa must be able to also run in a browser. This way, we ensure that we can implement tools such as our Chrome extension based on Alfa.\n",3153
"## Context and Problem Statement\nAll libraries use their own query syntax for advanced search options. To increase usability, users should be able to formulate their (abstract) search queries in a query syntax that can be mapped to the library specific search queries. To achieve this, the query has to be parsed into an AST.\nWhich query syntax should be used for the abstract queries?\nWhich features should the syntax support?\n",4738
"## Context\nGovUK Notify is used as the email provider for Keycloak: [0012 Keycloak Email Provider](0012-keycloak-email-provider.md)\nIt was decided to use a separate GovUK Notify service for each TDR environment as GovUK Notify does not have the concept of environments: [0014 GovUK Notify Multi-environment Configuration](0014-govuk-notify-multi-environment-configuration.md)\nGovUK services have a ""trial mode"", and a ""live mode"".\nThe trial mode has limits placed on who can receive emails, and the number of emails that can be sent.\n",1784
## Context\nTTA Smart Hub requires a continuous monitoring solution to ensure uptime and error resolution.\n,1171
"## Context\nWe want to enforce consistency in our code, and catch as many errors\nautomatically as we are able to. Linting the code is good practice to achieve\nthese aims. [Stylelint](https://stylelint.io/) is one of the more popular CSS\nlinters with support for SASS, and is easily configurable for our purposes.\n",458
"## Context\nPermissions on works and collections can come from two sources: 1) the person who authored the resource, such as the\ndepositor or the proxy depositor; and 2) access controls (ACLs) that grant permissions based on user or group identity.\nWhen determining who has access to a given resource, both these sources may need to be consulted.\n",4554
"## Context\nThe Data Migrate gem has caused us a number of issues in the past, it runs\nsilently as part of a deploy, and this can result in surprising errors\nduring a deploy. We've also had issues with the gem itself - most recently\na bug in a new version causing strange errors in deployment.\n",2396
"## Context\nWe have some ways to perform downloading stable in the background, but system exposed a service called `DownloadManager`.\nClient may request that a URI be downloaded to a particular destination file. The download manager will conduct the\ndownload in the background, taking care of HTTP interactions and retrying downloads after failures or across connectivity changes and system reboot.\nApps that request downloads through this API can register a broadcast receiver to handle when the download is progress, failure, completed.\n",1647
"## Context\nWe are doing a rewrite.\nHolochain Go code shows many implicit dependencies between different modules and stateful objects. In conjunction with the complexity of a p2p network of agents, this leads to a level of overall complexity that feels too much to manage. A clean and fitting architecture for this Rust rebuild is needed.\nHaving a single global state within the agent feels appropriate and even balancing the distributed nature of the network of agents.\n",1495
## Problem\nCurrently multiple warnings are saved in an elektra non-conforming array\nnotation which is limited to 100 entries. The notation of `#00` is against\nthe design [decision made](array.md).\n,1303
## Context\nThe service needs a way to authenticate trusted school buying professionals and to restrict the majority of access to the public.\nWe believe a simpler password-less authentication mechanism would be all that's required. This service does not need any of the school and user information held within DfE Sign-in (DSI). DfE governance has reviewed our concern and decided this service should use DSI.\nThere is currently no formal recommendation for a tool of choice in the technical guidance https://github.com/DFE-Digital/technical-guidance.\nWe want a tool that provides an open and modern security standard.\n,1252
"## Context and Problem Statement\nHow to guarantee reproducibility of Jupyter Notebooks?\nIn order to allow any user to re run the notebook with similar behaviour, it's important that each notebook is shipped with dependencies requirements\nthat include direct and transitive dependencies. This would also enforce and support security, reproducibility, traecability.\nNotebooks should be treated as component/service that use their own dependencies, therefore when storing notebooks,\nthey should be stored with dependencies so that an image can be built to run them or they can be shared and reused by others.\n## Decision Drivers <!-- optional -->\n* user prospective\n* reproducibility\n* traecability\n",1228
## Context\nWe need to record the architectural decisions that we make as we develop Ockam.\n,4539
"## Context\nThe issue motivating this decision, and any context that influences or constrains the decision.\n",3546
"## Context\nThis is a response from IITD Architecture to the IITD Infrastructure Team, and others, for an Official Statement on OpenJDK positioning.\n* Status: proposed\n* Deciders: Licence Change\n* Date: 2020-08-27\nTechnical Story: [description | <https://apps.nrs.gov.bc.ca/int/jira/browse/ARCH-62]>\n## Context and Problem Statement\nThis is a response from IITD Architecture to the IITD Infrastructure Team, and others, for an Official Statement on OpenJDK positioning.\n## Decision Drivers\n* An official Information Innovation & Technology Division (IITD) statement is needed on the direction forward for target versions of Java/JDKs for all IITD hosted java applications.  Oracle has changed its licensing model, and will now be using a subscription model for charging for the use of its Oracle Java SE product releases.\n* Java SE 8 is the end of the legacy versioning and release cadence model; Java 9 was the new beginning.\n* Oracle extended the public updates of its Oracle JDK to January 2019 for commercial production use, and at least the end of 2020 for individual desktop use.\n* Oracle JDK should be, for the most part, interchangeable with Oracle’s OpenJDK builds for those who want to move up to the next releases, as they did for Java 6->7 and Java 7->8.\n* Java 10 is the suggested release by Oracle\n* Oracle has posted more information on the roadmap for the Java Client (including Applets and Web Start).\n* Oracle plans to discontinue contributions to the JDK 8 Updates project until January 2019.\n* For security reasons, IITD Architecture encourages upgrade/migration of all java applications to at least JDK 11.\n* Scope - IITD all server and client side applications owned by IITD that run Java.\n",4802
"## **Context**\nValidation is an important function within APIs, to ensure that data that is submitted via API calls is properly checked to ensure it meets the requirements set by the business.\nWe will look at two options for validation:\n- **Data Annotations**\nThis involves ""annotating"" each class model with specific validation, such as\n- `[Required(ErrorMessage = ""This field is required"")]`\n- `[MaxLength(20)]`\nThere are a number of issues with this approach:\n- Validation is scattered throughout the codebase as attributes on data model classes\n- Testing is not straightforward\n- Error messages are part of the compiled code and it is not possible to decouple this, e.g. to allow for customisable error messages\n- Does not allow for conditional validation\n- **Fluent Validation**\nFluent Validation solves a number of the issues that DataAnnotation cannot be solved by Data Annotations. It:\n- Is easy to configure with minimal, unintrusive setup in `Startup.cs`\n- Lives outside of the data model classes\n- Very easy to test validation in isolation\n- Error messaging can be externalised using dependency injection\n- Allows for chaining of validators and conditional validation\n- Has a lot of built-in validation already (*if **x** exists, then **y** must also exist*)\n",2307
"## Context\nIn order to have a distributed version of James we need to have an homogeneous way to deal with `Task`.\nCurrently, every James nodes of a cluster have their own instance of `TaskManager` and they have no knowledge of others, making it impossible to orchestrate task execution at the cluster level.\nTasks are scheduled and ran on the same node they are scheduled.\nWe are also unable to list or access to the details of all the `Task`s of a cluster.\n",2127
## Context\nWe need to record the architectural decisions made on this project.\n,4401
"## Context\nAnalyzing untrusted Clojure code means loading it which should only be done in some kind of\nsandboxed environment. A Docker image has been created to help with this but this still\nrequires us to run and monitor job execution. Bad actors could still trigger many builds\nto run Bitcoin miners and other compute-stealing stuff.\nAlternatives to running Docker ourselves are AWS Lambda (probably similar compute-stealing\nissues) and ""hacking"" a continous integration service to do the job for us. More detail can\nbe found in the [notes on Isolation](https://github.com/martinklepsch/cljdoc/blob/72da65055ab94942f33fb63b29b732e81b559508/doc/isolation.md)\n",2601
