context,id
"## Context\nWe sought to determine whether to deliver our document management capabilities using the content management platform natively or through the integration of an external document management platform.\nWe sought to determine whether Bloomreach's 'Channel' concept would be suitable for managing the various sites required to be brought onto the platform both at MVP and in the future, such as Deenary and Speciality sights.\nAs part of this, considerations were made around:\n* Ease of use for creating new sites\n* Ability to share components\n* Ability to segregate content for specific channels (sites)\n* Ability to share content up and down the stack where needed and appropriate\n* Permissions model required to support this model\n",1205
"## Context\nWhen the team for the re-write of the Fundraising formed in 2016, we discovered that team members had different approaches to do validation:\n* Use an established library, like [Symfony Validation](https://symfony.com/doc/current/validation.html).\n* Write our own validation logic.\nThe arguments in favor of writing our own logic were:\n* We don't want to bind our domain layer to a concrete validation library implementation.\n* The individual validations - checking for required fields in most cases - are so simple that using an external library would make the validation more complicated.\n* We don't know the ""maintenance cycles"" of the library, either we need to constantly update or the library is not maintained properly.\n* Every developer would have to learn the API of the external library.\nAt the start of the project we did not know where we should put the validation logic:\n* At the framework/presentation layer, forcing us to create valid, fully formed domain objects as input for use cases.\n* At the use case layer, making validation part of the use case.\n",1532
"## Context and Problem Statement\nAs a user, I want to get Changes metrics related to tasks defined\nin a task tracker. A simple usecase example is to get insight of the\nratio of changes related to Feature Requests vs Bug fixing.\n## Decision Drivers\n* Simple implementation\n* No assumption about the tasks tracker\n* Support of a set of generic fields related to a task\n",4636
"## Context\nOur service-operator allows service teams to provision various AWS services by\ndeclaratively defining resources and submitting them via the kubernetes api.\nSome of these resources require IAM to authorise how the provisioned service\ncan be used. The types of actions that can be performed on.\n#### Example\nThe service operator allows provisioning of S3 buckets and bucket configuration such as:\n```\n---\napiVersion: storage.govsvc.uk/v1beta1\nkind: S3Bucket\nmetadata:\nname: s3-bucket-sample\nspec:\naws:\nLifecycleRules:\n- Expiration: 90days\nVersioning:\nEnabled: true\n```\nIn order to access a provisioned bucket via the the AWS SDK users will require\nan IAM role/policy that allows access.\nWe want things like bucket ACL, versioning configuration and lifecycle policy\nto be defined declaratively via the resource manifest (see example above), and continuously managed\nby the service operator.\nWe want users of the provisioned bucket to be able to read back all\nconfiguration, and be able to fully utilise the specific bucket for reading,\nwriting and managing their objects within the provisioned bucket, but we want\nto avoid giving permissions to users that could cause conflicts with the\nproperties that are managed by the service operator's reconcile loop.\nFor example, given the example manifest above, we would like to avoid giving\npermissions that would allow a user to alter the Expiration LifeCycleRules,\nsince any changes the user made would be periodically overwritten by the\nservice operator's reconciliation.\n",3907
## Context\nIt is necessary to provide autocomplete functionality to make certain fields quicker to enter by suggesting potential results to the user.\n,1255
"## Context and Problem Statement\nDeciding how to have the internal components of the Transcript Editor communicate with each other.\n## Decision Drivers <!-- optional -->\n* Simple and straightforward way to reason around passing data between components\n* Extensible anticipating use cases when using the component ""in the wild"" and having internal info accessible/when if needed.\n",3187
"## Context\nWe want to avoid testing implementation details in our integration tests.\nWe want to use `react-testing-library` which makes it easier to make assertions on the rendered DOM rather than assert implementation details. But mostly because it enable us to find and trigger click events on different UI elements.\ne.g. toggling the visibility of different tabs and window groups.\nBut when it comes to asserting the rendered DOM, in most cases we trust the view will render the model properly.\nIt could be more sensible to only verify the state/model.\n",2816
## Context\nPresently when submitting new properties or editing existing properties within inventory the only way to set the latitude and longitude values is manually.\nIdeally the inventory would use GIS location values that are pulled from Data BC (better source of truth).\nProviding a way through the property address to pull valid GIS coordinates from Data BC Geocoder would improve the data and the user experience.\nAdditionally Geocoder can be used to verify addresses that are manually entered.\n- [Geocoder](https://www2.gov.bc.ca/gov/content/data/geographic-data-services/location-services/geocoder)\n- [Data BC](https://catalogue.data.gov.bc.ca/dataset/bc-address-geocoder-web-service)\n- [API Swagger](https://catalogue.data.gov.bc.ca/dataset/bc-address-geocoder-web-service/resource/40d6411e-ab98-4df9-a24e-67f81c45f6fa/view/1d3c42fc-53dc-4aab-ae3b-f4d056cb00e0)\n- [Developer API Keys](https://github.com/bcgov/gwa/wiki/Developer-Guide#developer-api-keys)\n- API Host = `https://geocoder.api.gov.bc.ca`\n,3968
## Context and Problem Statement\nWhile extracting the `Grant-wise expenditure` a lot of site crashes were encountered. A decision was taken earlier to extract the `DDO-wise expenditure` section from Koshvani as both section contain the same information in different heirarchies.\n## Decision Drivers\nThe challenges around site crashes have been addressed and the `Grant-wise expenditure` section can now be extracted.\n,447
"## Context and Problem Statement\nOperations can be defined in the FDML as elements and attributes or simply as elements.  For example the operation take can be described as:\n```\n<xs:element name=""take"" type=""xs:integer"">\n```\nor with attributes as:\n```\n<xs:element name=""take"">\n<xs:complexType>\n<xs:attribute name=""value""/>\n</xs:complexType>\n</xs:element>\n```\n## Decision Drivers\n* consistency\n* expressiveness\n",4713
"Context\n-------\n``Event-routing-backends`` transforms and emits edx events that may contain PII which is not meant to be shared with learning record consumers. New xAPI and Caliper transformers are expected to be added in ``Event-routing-backends`` and therefore, a mechanism needs to be put in place to reduce chances of PII leakage via these transformers.\nDecision\n--------\n#. An accessor `method`_ will be developed to get values from open edx events for a specified key. Information inside the open edx event will only be accessed using this accessor method in base transformers and in event transformers.\n#. If a key, required by the specification (xAPI or Caliper), is not found in open edx event, this method will throw an exception.\n#. If a key, deemed optional by the specification (xAPI or Caliper), is not found in open edx event, this method will log this instance and return None.\n#. The efficacy of fuzzy comparison between keys in transformed events and potential PII keys will be evaluated in future and incorporated if found useful.\nBenefits\n---------\n#. Only the instances where this accessor is called, will need to be reviewed during code review, in order to check for potential PII leakage.\n.. _method: https://github.com/openedx/event-routing-backends/blob/f430d4cf58bdab01e42fcc944241898606873d82/event_routing_backends/processors/mixins/base_transformer.py#L139\n",4477
"# Context\nThe way the Government Digital Service (GDS) [makes technology choices is\ndescribed in the service manual](https://www.gov.uk/service-manual/making-software/choosing-technology). We are selecting which technology will to use to provide\npersistence for the Performance Platform.\nGDS has experience in running MongoDB and MySQL in production.\nWe envisage the Performance Platform as taking in unstructured data from a\nvariety of data sources (spreadsheets, analytics, logs, other databases and\napplications) and allowing people to collect this data in a single place. This\nshould enable service managers to:\n- make comparisons\n- see how well their service is performing\n- see how the performance changes over time, as they iterate the service\nSo we want a persistent data store that will store unstructured data, and\nallow us to apply a structure either by post-processing the data, or at query\ntime.\nThe volume of the data that we are envisaging at this stage is pretty small.\nWe will be building a small thing to start; as we learn more about the\nuser needs and problem space, then we will revisit this decision. Since the\nvolume is small, it does not seem likely that we need Hadoop / HDFS or\nCassandra.\nWe are not the canonical source of this data. We are an aggregator; the\ncanonical source remains the data sources which will be providing feeds or\npushing the data into the Performance Platform.\nBecause of this position, we do not need ACID properties for this data, nor\nneed worry about the CAP theorem in any detail.\n# Decision\nWe will use MongoDB. We are comfortable operating it in production,\nit will allow unstructured data (in the form of JSON documents) and we can\napply structure at query time.\n# Status\nAccepted.\n# Consequences\nUse MongoDB with an appropriate replica-set configuration.\n",4266
"## Context and Problem Statement\nTax users are sometimes, without warning, unnecessarily signed out when accessing\nMDTP services using multiple browser tabs or windows. This is a violation of [WCAG 2.1\nsuccess criterion 2.1.1 (Timing adjustable)](https://www.w3.org/WAI/WCAG21/Understanding/timing-adjustable.html).\nThis problem is a consequence of the fact that a user's session can be refreshed via user activity in any\ntab or window belonging to the same browser profile. However, the Javascript-powered [hmrcTimeoutDialog](https://github.com/hmrc/play-frontend-hmrc#warning-users-before-timing-them-out)\ncurrently has no way of knowing about this activity following initial page load.\nSolving this issue requires providing the timeout dialog component with knowledge of the actual time\nremaining on the user's active session via an endpoint that is itself excluded from\nsession management.\nHow can we achieve this cost-effectively while minimising impact for service teams, limiting duplication of\nknowledge and avoiding introducing additional coupling between frontend microservices?\n## Decision Drivers\n* The need to minimise code changes for service teams other than a library upgrade.\n* The avoidance of requiring service teams to add any additional routing rules.\n* The avoidance of requiring service teams to add any additional configuration.\n* The need to limit duplication of knowledge between SessionTimeoutFilter in bootstrap-play and\nany other library or service.\n* The preference for maintaining loose coupling of frontend services and avoiding adding single points\nof failure between frontend microservices.\n* The need for the endpoint used to interrogate the session to not itself affect the session.\n",560
## Context\nYou never think of everything. Sticking to standards is a very good\nthing to prevent you from doing things that can go bad. Those also\nhelps making the code be more readable and structured.\n,1418
"## Context\nThis ADR has been superseded by `ADR-0019`.\nSome actions and features of Raster Foundry require a way to manage asynchronous tasks and workflows.\nFor instance, user uploads of imagery or tools may start workflows in an ad hoc manner, while in\ncontrast imports of imagery from NASA or partners may need to happen on a schedule. The nature of\nthese tasks could vary from bash scripts and python functions to spark jobs and ECS tasks.\nThe ideal tool will provide some means to monitor task progress, retry on some failures, and\nnotify personnel if necessary. There are a few options of tools we can use: celery, SWF, Luigi, and Airflow.\nAzavea has experience working with both celery and SWF; however, due to our past experience with these\ntools it seemed prudent to explore additional options as well.\n| Workflow Tool   | Pros | Cons |\n|-----------------|------|------|\n| Celery          | Familiar, written in python, flexible | Provides poor primitives for workflows, many open issues, difficult to monitor workflows |\n| SWF (botoflow)) | Familiar, now written in python, maintaining state is not our responsibility (HA by default), great primitives for workflows and tasks | Difficult to monitor, relatively immature tools and projects, not many others using it |\n| Luigi           | Mature, seems to be stable, written in python | Unfamiliar execution model, primarily designed for scheduled, recurring task |\n| Airflow         | Mature, stable, fits into our execution model, written in python, excellent UI | Requires celery (for what we want to do)), requires managing the scheduler and a cache |\n",1688
"## Context and Problem Statement\nPersistence and retrieval of SKOS taxonomies require a storage layer that supports storing rich, free-form linked data.\nSuch a data model could be represented in a traditional RDBMS, however, doing so would require a specialized serialization and deserialization implementation whereas graph databases can typically store RDF natively.\n## Decision Drivers <!-- optional -->\n* High availability/Fault tolerance\n* Learning curve\n* Maintenance overhead\n* Vendor lock-in\n",1510
## Context\nWe need to record the architectural decisions made on this project.\n,3475
"## Context\nThere are lots of different tasks that need processed in order to get the prototype kit up and running. Tasks such as; installing dependencies, moving files from dependencies into the app file structure, and most importantly - running the application.\n",3682
"## Context\nMailQueue is a central component of SMTP infrastructure allowing asynchronous mail processing. This enables a short\nSMTP reply time despite a potentially longer mail processing time. It also works as a buffer during SMTP peak workload\nto not overload a server.\nFurthermore, when used as a Mail Exchange server (MX), the ability to add delays to be observed before dequeing elements\nallows, among others:\n- Delaying retries upon MX delivery failure to a remote site.\n- Throttling, which could be helpful for not being considered a spammer.\nA mailqueue also enables advanced administration operations like traffic review, discarding emails, resetting wait\ndelays, purging the queue, etc.\nSpring implementation and non distributed implementations rely on an embedded ActiveMQ to implement the MailQueue.\nEmails are being stored in a local file system. An administrator wishing to administrate the mailQueue will thus need\nto interact with all its James servers, which is not friendly in a distributed setup.\nDistributed James relies on the following third party softwares (among other):\n- **RabbitMQ** for messaging. Good at holding a queue, however some advanced administrative operations can't be\nimplemented with this component alone. This is the case for `browse`, `getSize` and `arbitrary mail removal`.\n- **Cassandra** is the metadata database. Due to **tombstone** being used for delete, queue is a well known anti-pattern.\n- **ObjectStorage** (Swift or S3) holds byte content.\n",2892
"## Context\nThe main data source of the API catalogue website was originally a collection of\nmarkdown files. The build process uses the Middleman static site generator\nconfigured by the [Tech Docs Gem](https://github.com/alphagov/tech-docs-gem)\n('TDG').\nThe TDG provides additional functionality including search, sidebar\nnavigation ('Table of Contents'), the layout, and styling.\nThe TDG is not necessarily a good fit for the API catalogue because the project\nisn't purely documentation, and our data source is now a CSV.\nIn particular it is difficult to override templates inherited from the gem, to\nadjust the layout on a particular page or add page-specific JavaScript for\nexample.\nUsing TDG to render the Table of Contents is slow for our site because\nby design every page is re-rendered multiple times to pull out the headings\n(adding over a minute to build times).\nThe TDG also requires specific dependency versions. These version\nrestrictions prevent us being in control of version upgrades which are necessary\nto remain on support versions and receive security patches.\n",3586
"## Context and Problem Statement\nThe organization has several UI apps and libraries and of them have different React versions, causing issues whenever we want to consume them. To remove these problems, and to keep every app updated, we need to move to React 17 in every UI app and lib, specially in the UI repository that contains most of our shared UI components.\nUpdating the UI repository to the latest version of React implies updating `react-semantic-ui` to its latest version, ending up in [a major change that removed the `Responsive` component](https://github.com/Semantic-Org/Semantic-UI-React/pull/4008), a widely used component dedicated to conditionally rendering different components based on their display. Removing this component will cause a breaking change in our current [UI library](https://github.com/decentraland/ui) and will imply everyone to get on board of this breaking change, but a different strategy can be chosen by keeping the `Responsive` component by copying it from the library until everyone gets on board with an alternative.\nWe need to provide, alongside this update, an alternative library to the `Responsive` component, providing a similar or a better API for rendering components according to device sizes.\n- The `@artsy/fresnel` works by using a ContextProvider component that wraps the whole application, coupling the media query solution to this library.\n- Doesn't have hooks support.\n#### Second alternative (react-semantic-ui)\n##### Advantages\n- The libary doesn't require a provider or something previously set in an application to use it (non-coupling dependency).\n- Provides hooks and component solutions for rendering components with different media queries, providing a versatile that allows us to render different components or part of the components by using the hooks.\n##### Disadvantages\n- Bad SSR support.\n",4613
"## Context\nEach commercial agreement will ask the buyer questions in order to ascertain what outcomes and supplier offers are applicable to the buyer. Some of these questions will be the same across agreements. Many will have common patterns and data, even if they differ in detail.\nIn the future we will want to more automatically match buyers’ articulations of need so as to work out which products CCS can offer to meet their need.\nThe buyer needs data needs to be stored during a buying journey, but final agreement details, when the buyer agrees a call-off for instance, will need to be stored in the agreement records.\n",1001
## Context\nTravis has some limitations about what stages you can use to create a pipleine.  We still desire to have a hosted/PaaS CI/CD solution\n,1741
"## Context\nThere are a number of ways an API could allow clients to upload files to S3, the popular ones:\n- Allow the API to accept Base 64 encoded files in a JSON POST request and subsequently send this blob to S3\n- Allow the API to accept multipart form uploads, compile the parts on the server then send the file to S3\n- Use the S3 Presigned URL functionality, which allows the client to act as the IAM which created the URL for a single operation, and upload the file directly to S3 themselves\n",3987
## Context\nSmarthub project consist of multiple packages which are the part of Smarthub SDK. Complex dependency graph forces us to update dependent packages manually every time dependency has changed.\n,3691
"## Context\nDrop FreeTFT, TFTA tokens from SDK\n",5198
"## Context\nThe issue motivating this decision, and any context that influences or constrains the decision.\nThe original author of go-bindata delete their account and then the repo was\nrecreated under a different owner. The dependency has shifted around enough that\nwe have lost faith in the intention of the maintainers\n[more details here](https://twitter.com/francesc/status/961249107020001280?lang=en)\nAlso, some of the development use cases around go-bindata (like what is bundled into the code\nduring a test run or final build) made it hard to reason about.\n",3873
"## Context\nThe Code Style Guide is a set of conventions on how to write the source code. It covers many areas, including the use of `camelCase` vs `PascalCase` for variable identifiers, whether or not to use a semicolon as a statement terminator, or the use of tabs or spaces for indentation.\nIt is obvious that an enforced, unified code style in a project is beneficial. Not only does it improve the readability, but it also saves you from a lot of noise while looking at diffs, caused by unadjusted whitespaces, different break line settings, and other issues. It also ends discussions around the style itself. Once applied, everyone can write code the way they want, and let the formatter do the work. In the end, it saves time and energy.\n[Prettier](https://prettier.io) is one of the solutions dedicated to code formatting. It does not enforce such code quality rules as the use of globally scoped variables or naming. It only enforces the formatting rules. It can be used as a plugin for selected IDEs, as a pre-commit `git` hook, or as a standalone CLI tool. No matter which option you choose, it produces the same output given its configuration.\nIt was chosen because of its simplicity, ease of configuration, small amount of available options, and support for JavaScript, TypeScript, GraphQL, CSS, SCSS, and JSON, all of which are used in Kyma projects.\n",3451
## Context\nWe have to make a decision on the branching strategy for development.\n,3653
## Context\nWe need to avoid side effects on configuration loading and prevent the need to fully configure the settings to run a subset of tests in projects using `konfetti`.\n,3572
"## Context\nDriver interfaces were previously defined in the global namespace, and associated types were defined as `struct`s in the global namespace with a generic name like `tof`:\n```\nstruct tof\n{\nusing distance_t = uint16_t;\nusing cb_t = stdext::inplace_function<void(distance_t)>;\nstatic const distance_t INVALID_RANGE = UINT16_MAX;\nenum class mode\n{\ndefaultRange = 0,\nshortRange,\nmedRange,\nlongRange,\n};\n}''\n```\nInterface classes would inherit from these structs:\n```\nclass TimeOfFlight : public embvm::DriverBase, public embvm::tof\n```\nAnd the effect was similar to namespacing (`embvm::tof::mode`):\n```\nvirtual embvm::tof::mode mode(embvm::tof::mode m) = 0;\n```\nEssentially, we are recreating a feature that `namespace` already provides and complicating our inheritance chains.\n",3027
"### Context\nWhen executing code that is expected to fail in a test case, there is two ways to do this:\n```php\nfunction test_something(): void {\n// ...\ntry {\n// the statement that fail\n$this->fail();\n} catch (Exception $e) {\n// ...\n}\n}\n```\nOr:\n```php\nfunction test_something(): void {\n// ...\n$this->expectException($exception)\n// the statement that fail\n}\n```\n### Decision\nAs recommended by [Sebastian Bergmann][sebastian-bergmann] in\n[this article][phpunit-exception-best-practices], since in both cases a PHPUnit specific API is\nnecessary, the decision taken is to leverage the `expectException*()` API when possible.\nA pull request to fix this practice in the whole codebase may be done but has not been made\nmandatory. New pull requests though should stick to this practice.\n### Status\nAccepted ([#1090][1090])\n[sebastian-bergmann]: https://thephp.cc/company/consultants/sebastian-bergmann\n[phpunit-exception-best-practices]: https://thephp.cc/news/2016/02/questioning-phpunit-best-practices\n[1090]: https://github.com/infection/infection/pull/1061\n",68
